{
  "schema_version": "3.4.0",
  "request_id": "req_2026-04-28_6a2d8800",
  "proposal_id": "prop_2026-04-28_b3f1a2c4",
  "call_id": "call_2026-04-28_7e19c5ad",
  "tenant": "acme-corp",
  "action_hash": "sha256:fa91547ede90b5e71af350eeed3be5272dc40be522a84a6e32045ef8f4db1e64",
  "validation_id": "validation_2026-04-28_841ac000",
  "review_snapshot_id": "review_2026-04-28_47b2c000",
  "callback_nonce_hash": "sha256:91eaf28be1fa8121d74d9ce65298da05363c70dfb691c4c4e1a17691bb09966a",
  "requested_at": "2026-04-28T09:14:25Z",
  "expires_at": "2026-04-28T17:14:23Z",
  "status": "consumed",
  "revision": 3,
  "requested_by": {
    "kind": "system",
    "identifier": "approval-router",
    "authentication": {
      "method": "service_identity",
      "human_present": false,
      "assurance": "high",
      "authenticated_at": "2026-04-28T09:14:25Z"
    }
  },
  "policy": {
    "schema_version": "3.4.0",
    "policy_id": "policy.high-risk-email.v1",
    "revision": "2026-04-15.3",
    "policy_digest": "sha256:a4f5ac837738a43e70baa0f2d602bbba2f2285a518beb568746f310f0678dc35",
    "evaluation_id": "eval_2026-04-28_1c4f8a00",
    "material_input_hash": "sha256:fa91547ede90b5e71af350eeed3be5272dc40be522a84a6e32045ef8f4db1e64",
    "evaluated_at": "2026-04-28T09:14:24Z",
    "outcome": "require_approval",
    "requirements": {
      "minimum_approvals": 1,
      "distinct_approvers": true,
      "human_only": true,
      "allowed_channels": [
        "email",
        "web"
      ],
      "signature_required_channels": [
        "email"
      ],
      "allow_auto_approval": false,
      "human_required_effects": [
        "destructive",
        "open_world"
      ],
      "required_roles": [
        "customer-support"
      ],
      "separation_of_duties": {
        "requester_must_not_approve": true,
        "agent_must_not_approve": true,
        "distinct_signing_keys": true,
        "eligible_approver_ids": [
          "rene@acme-corp.example"
        ],
        "excluded_actor_ids": [
          "approval-router",
          "agent.support-triage.prod"
        ],
        "excluded_key_ids": [
          "agent-fleet-shared-key"
        ]
      }
    }
  },
  "channels": [
    {
      "channel": "email",
      "target_hash": "sha256:e8e3f7b243a672993b9c238585042b95995665863cc28ff00adeafca8e5ecb1b",
      "delivery_status": "delivered",
      "notification_id": "mail_2026-04-28_3391",
      "sent_at": "2026-04-28T09:14:26Z"
    }
  ],
  "terminal_at": "2026-04-28T09:14:31Z",
  "decision_record_id": "approval_2026-04-28_f9821000",
  "consumed_at": "2026-04-28T09:14:33Z",
  "dispatch_id": "dispatch_2026-04-28_4ad31000",
  "terminal_reason": "consumed_for_dispatch"
}
